image_id,user_id,title,shortcode,src,comments_count,comments_disabled,taken_at,likes,location,accessibility_caption,duration,captions
3496066117515760431,3863839299,,DCEhZxlzlMv,https://scontent-lga3-1.cdninstagram.com/v/t51.29350-15/465896023_8797720223641891_9018749493921644392_n.webp?stp=dst-jpg_e35_p1080x1080&_nc_ht=scontent-lga3-1.cdninstagram.com&_nc_cat=1&_nc_ohc=DjbusCMSaVwQ7kNvgEZ-O4j&_nc_gid=2d949a263a344f5ea7eba96d5aac2166&edm=AOQ1c0wBAAAA&ccb=7-5&oh=00_AYBZ7bJxLL7e7mx5TxybWxTiQlglyKzl_8PVx65rrgp2cQ&oe=673335D6&_nc_sid=8b3546,72,False,1730983579,6950,,,,"['Dilansir dari Antara, Selasa (5/11/2034), negara pertama yang akan dikunjungi Prabowo sebagai presiden adalah China. Ketua Umum Partai Gerindra tersebut dijadwalkan mengunjungi Negeri Tirai Bambu pada Jumat (8/11/2024) hingga Minggu (10/11/2024). Lantas, apa saja agenda Prabowo selama di China?\n\nPrabowo berkunjung ke Negeri Tirai Bambu setelah menerima undangan secara langsung dari Presiden China Xi Jinping. Kementerian Luar Negeri (Kemenlu) RI menyebutkan, kunjungan Prabowo ke China memberi makna penting bagi penguatan kerja sama antara Indonesia dengan Negeri Tirai Bambu. \n\nSebagaimana diberitakan Kompas.id, Selasa (29/10/2024), Prabowo memiliki sejumlah agenda, seperti menghadiri undangan jamuan kenegaraan dengan Xi Jinping, berkunjung ke Tembok Besar China (Great Wall), dan meletakkan karangan bunga di Monumen Pahlawan Rakyat China di Lapangan Tiananmen, Beijing. Prabowo juga akan bertemu Perdana Menteri China Li Qiang dan Partai Komunis China atau National People’s Congress (NPC). \n\nKunjungan Prabowo ke China merupakan yang kedua kali setelah ia bertemu Xi Jinping di Beijing pada April 2024. Baca juga: Di Balik Pertemuan Ridwan Kamil dengan Prabowo dan Jokowi, Bahas Apa Saja? Pada saat itu, Prabowo melakukan lawatan luar negeri ke China dalam kapasitasnya sebagai Menteri Pertahanan sebelum ditetapkan menjadi presiden terpilih oleh KPU. \n\nPrabowo sudah membeberkan rencananya berkunjung ke China setelah dilantik menjadi presiden ketika berpidato di acara deklarasi Gerakan Solidaritas Nasional (GSN) di Gelora Bung Karno, Jakarta pada Sabtu (2/11/2024). Ia mengatakan, selain mendapat undangan dari China, Prabowo juga diminta datang ke Amerika Serikat (AS). \n\n“Salah satu kewajiban pertama harus berangkat ke luar (menghadiri KTT) APEC, ke (KTT) G20. Diundang ke Tiongkok. Begitu diundang ke Tiongkok, Amerika juga mengundang. Waduh ini dua kekuatan besar ngundang, ya enggak berani saya nolak,” ujar Prabowo dikutip dari Kompas.com, Sabtu (2/11/2024).\n\nArtikel : Kompas.com\n\nFollow @jadijagomandarin kuy biar gak ketinggalan konten lucu dan menarik seputar bahasa Mandarin✨\n\n#meme #funnyvideos #dailymemes #mandarin #kursusmandarin #mandarinless']"
3496015159606242244,3863839299,,DCEV0PVtevE,https://scontent-lga3-1.cdninstagram.com/v/t51.29350-15/465823338_1150471849828298_5617252086876872986_n.jpg?stp=dst-jpg_e15&_nc_ht=scontent-lga3-1.cdninstagram.com&_nc_cat=102&_nc_ohc=dmJ36b9sck4Q7kNvgFsP6aP&_nc_gid=2d949a263a344f5ea7eba96d5aac2166&edm=AOQ1c0wBAAAA&ccb=7-5&oh=00_AYCKwxnckx7f1FzNjwIP64eTA-8Fizr5fMy-wvayZj7Lww&oe=6733173A&_nc_sid=8b3546,8,False,1730977500,514,Dokuz Eylül Universitesi Tinaztepe Kampüsü,,,['Nah kalau ini ada yang tau ga? 😃\n\nMasih gak PD saat ngomong Inggris? Mau ningkatin skill biar jadi PD ngomong Inggris? \n\nKetik MAU di kolom komentar kuyy! \n\nBantu kamu jago speaking untuk menunjang karir dan pekerjaanmu 👩🏻\u200d🎓📚\n\n✨LearningWithExperts✨\n\n#learnenglish #english #kampunginggris #belajarbahasainggris #education #englishclass']
3495960225347588996,3863839299,,DCEJU10vNOE,https://scontent-lga3-1.cdninstagram.com/v/t51.2885-15/466033329_18061519096808495_8714640723956810765_n.jpg?stp=dst-jpg_e15_fr_p1080x1080&_nc_ht=scontent-lga3-1.cdninstagram.com&_nc_cat=111&_nc_ohc=8WX236odx5IQ7kNvgFo5wMv&_nc_gid=2d949a263a344f5ea7eba96d5aac2166&edm=AOQ1c0wBAAAA&ccb=7-5&oh=00_AYD8Wyt8TyzdbUpnt9ltW_QwDMfog0573QT6HEEKLI1xIg&oe=67332257&_nc_sid=8b3546,1,False,1730970976,366,,,,['Langsung merasa jago dan tak tertandingi wkwk 😎👍🏻\n\nMau speaking gak pake mikir? Ikutan kelas kita kuy! Cus ketik MAU di kolom komentar atau klik link di BIO ya! ✨🚀\n\n #speaking #english #learnenglish #funnymemes #belajarbahasainggris #speakenglish #kampunginggris']
3495906151517347137,3863839299,,DCD9B9pS11B,https://scontent-lga3-2.cdninstagram.com/v/t51.29350-15/465833364_527425513539496_1165408614336800928_n.jpg?stp=dst-jpg_e15&_nc_ht=scontent-lga3-2.cdninstagram.com&_nc_cat=104&_nc_ohc=iZ5wLg5Df9kQ7kNvgElQS9Y&_nc_gid=2d949a263a344f5ea7eba96d5aac2166&edm=AOQ1c0wBAAAA&ccb=7-5&oh=00_AYCV2N0dob3wlzyf7HJLgHbTUnf6dx2Ucg5iw0mMU1X_uA&oe=6733386B&_nc_sid=8b3546,2,False,1730964529,107,,,,"['“ tips tricks dahsyat buat belajar bahasa Inggris, dari Capt ibnu dan Capt Yahya 😃”']"
3495866855275997333,3863839299,,DCD0GIKyaiV,https://scontent-lga3-2.cdninstagram.com/v/t51.29350-15/465919389_520035404362773_5999181879914198198_n.webp?stp=dst-jpg_e35_p1080x1080&_nc_ht=scontent-lga3-2.cdninstagram.com&_nc_cat=109&_nc_ohc=q1Zf0JZpmzkQ7kNvgGl_3Wc&_nc_gid=2d949a263a344f5ea7eba96d5aac2166&edm=AOQ1c0wBAAAA&ccb=7-5&oh=00_AYCW8zqkiXNHXJWWf3SwYbzuZIBoi1vkqqcbtYxLHx3Szw&oe=67333932&_nc_sid=8b3546,28,False,1730959825,1038,,,,"['Wiihhh apa ya kira2 bahasa Inggrisnya\n\nJangan lupa follow @kampunginggrism biar makin mantull belajar bahasa inggrisnya dong 🔥🤩\n\nMau 3 bulan PD speaking English?? cus ketik aja ""MAU"" di komen nanti Mingo DM ya 😎\n\n#kursusbahasainggris #JadiBisa #LearningwithExperts #kampunginggris #englishclasses']"
3495803496302006934,3863839299,,DCDlsIhplKW,https://scontent-lga3-1.cdninstagram.com/v/t51.29350-15/465668559_1297476848037999_2044202875594377581_n.webp?stp=dst-jpg_e35_p1080x1080&_nc_ht=scontent-lga3-1.cdninstagram.com&_nc_cat=103&_nc_ohc=T6nQOHbSe7sQ7kNvgGZpKIo&_nc_gid=2d949a263a344f5ea7eba96d5aac2166&edm=AOQ1c0wBAAAA&ccb=7-5&oh=00_AYC-Hpnay2gD67l101A3_UR4T7-ayOQVmnMwkAeb8Ox-yQ&oe=67331AB5&_nc_sid=8b3546,4,False,1730952272,724,,,,['Follow @inggrismcom dong biar gak ketinggalan konten menarik seputar beasiswa dan work abroad ✨\n\n📚Bantu tingkatin bahasa Inggrismu untuk study dan work abroad \n\n✨your perfect partner to reach your dream✨\n\nMau upgrade nilai TOEFL/IELTS buat daftar beasiswa atau work abroad? \nCus ketik MAU di kolom komentar ya 🙌🏻\n\n#scholarship #studyabroad #motivation #infobeasiswa #university #australia #whv']
3495762611269227110,3863839299,,DCDcZLXy1Jm,https://scontent-lga3-1.cdninstagram.com/v/t51.29350-15/465805387_1086433216517612_1612358017009670273_n.jpg?stp=dst-jpg_e35_p1080x1080_sh0.08&_nc_ht=scontent-lga3-1.cdninstagram.com&_nc_cat=108&_nc_ohc=8ljI6YkUNdIQ7kNvgEQgN9v&_nc_gid=2d949a263a344f5ea7eba96d5aac2166&edm=AOQ1c0wBAAAA&ccb=7-5&oh=00_AYCYJKNDE-t_EvDIYrYgRFPkwVBnwY2-mSDbqmApr8j87A&oe=6733133A&_nc_sid=8b3546,149,False,1730947451,16451,,,,['Pertarungan sengit nihh 😾😼\n\nMau speaking gak pake mikir? Ikutan kelas kita kuy! Cus ketik MAU di kolom komentar atau klik link di BIO ya! ✨🚀\n\n #speaking #english #learnenglish #funnymemes #belajarbahasainggris #speakenglish #kampunginggris']
3494974559713873802,5481270177,,DCApNhKxc-K,https://scontent-lga3-1.cdninstagram.com/v/t39.30808-6/465716917_1095235632049842_5299289792709882172_n.jpg?stp=dst-jpg_e15_fr_s1080x1080&_nc_ht=scontent-lga3-1.cdninstagram.com&_nc_cat=106&_nc_ohc=AYis_QMpx6QQ7kNvgGJkACb&_nc_gid=6689ade6e1c94196941c05089512edda&edm=AOQ1c0wAAAAA&ccb=7-5&oh=00_AYAKVFgvTFZ-YqyncItHF7eYkWIm6vM0nOgl4BgbpiXS5A&oe=67332038&_nc_sid=8b3546,1314,False,1730853456,2194,,,,"['Tenho o prazer de convidá-los para minha nova Comunidade ""Bíblia: Para Quem Crê ou Não Crê""!\n\nNos próximos 12 meses, vamos explorar juntos a obra que moldou a cultura ocidental, analisando suas mensagens, personagens e mistérios de forma respeitosa e sem dogmas. Ao se inscrever, você terá acesso a:\n- Aulas exclusivas sobre a Bíblia\n- Áudios matinais no seu WhatsApp\n- Acesso à Comunidade fechada no Facebook e Instagram\n- Análise de obras de arte\n- Curadoria de músicas e livros \n- Bônus: Audiossérie \'Filosofia de Vida\', gravada em parceria com Mario Sergio Cortella\n\nNão importa sua crença, a Comunidade é um espaço para aprender, refletir e debater, com o respeito que o tema merece. \n\nComente \'Bíblia\' e venha comigo nesta jornada! 📖']"
3496139336112119988,5481270177,,DCEyDPuO6C0,https://scontent-lga3-1.cdninstagram.com/v/t51.29350-15/465878018_1616100012328506_355092996616879979_n.jpg?stp=dst-jpg_e15&_nc_ht=scontent-lga3-1.cdninstagram.com&_nc_cat=106&_nc_ohc=v7Z_JbCAGK4Q7kNvgFUdeRS&_nc_gid=6689ade6e1c94196941c05089512edda&edm=AOQ1c0wBAAAA&ccb=7-5&oh=00_AYAmfkQKBAh7EBi5kXilh6QANtXR9C7B_rzP6FwwoU1YpQ&oe=67332625&_nc_sid=8b3546,219,False,1730992470,3417,,,,"['Religiões costumam ter mitos de criação da humanidade. Todos conhecemos a história de Adão e Eva, que aparece em Gênesis - o primeiro livro do Velho Testamento. Mas você sabe o que a criação do primeiro casal e a expulsão do Jardim do Éden têm a nos ensinar?\n\nConheça a nova comunidade “Bíblia: Para Quem Crê ou Não Crê”. As inscrições estão abertas e são por tempo limitado! Para saber mais, comente “BÍBLIA”.']"
3495906517687302770,5481270177,,DCD9HSquXpy,https://scontent-lga3-1.cdninstagram.com/v/t51.2885-15/465971329_18345153355182178_6195453337816456561_n.jpg?stp=dst-jpg_e35_s1080x1080_sh0.08&_nc_ht=scontent-lga3-1.cdninstagram.com&_nc_cat=1&_nc_ohc=GMXiaqswHvwQ7kNvgGa_Pvi&_nc_gid=6689ade6e1c94196941c05089512edda&edm=AOQ1c0wBAAAA&ccb=7-5&oh=00_AYCCgfoBGHedrMkKuFtZXg8nMsaMj-xXeu6zST94qmMvgQ&oe=6733335A&_nc_sid=8b3546,595,False,1730964554,32632,,,,['Provérbio africano: “que a morte te encontre vivo”. A ideia é não morrer antes da morte. Dois passos que eu sigo: foco no presente e tentar não ficar observando caminhos alheios. Quinta começando. Você esta vivo e focado? Bom dia!']
3495455154329888108,5481270177,,DCCWfFyJCVs,https://scontent-lga3-1.cdninstagram.com/v/t51.29350-15/465705040_865679615550383_5233390432051699133_n.jpg?stp=dst-jpg_e15&_nc_ht=scontent-lga3-1.cdninstagram.com&_nc_cat=111&_nc_ohc=MnXXGzmPb0AQ7kNvgGaGf4U&_nc_gid=6689ade6e1c94196941c05089512edda&edm=AOQ1c0wBAAAA&ccb=7-5&oh=00_AYDRB5mRS_Zk9BnBBT_M1Ple18tFrx41DygadzG14rl18g&oe=67332883&_nc_sid=8b3546,185,False,1730910860,2256,,,,"['A Bíblia é um livro histórico, literário, filosófico e religioso que moldou profundamente nossa cultura. Impactou o desenvolvimento de línguas modernas, deixou sua marca na arte e na literatura e influencia códigos éticos e morais por mais de 2.500 anos. \n\nNossas práticas sociais também estão ligadas a ela: festas como o Natal e as juninas celebram eventos e personagens bíblicos. Compreender a Bíblia é essencial para entender o mundo em que vivemos, seja você cético, ateu ou religioso. Afinal, sem ela, nossa história seria outra.\n\nNa minha nova comunidade “Bíblia: Para Quem Crê ou Não Crê”, vamos explorar juntos a obra que moldou a cultura ocidental, analisando suas mensagens, personagens e mistérios de forma respeitosa e sem dogmas. \n\nComente ‘Bíblia’ e garanta sua vaga!']"
3493475407376300103,5481270177,,DB7UV-wOjhH,https://scontent-lga3-2.cdninstagram.com/v/t51.29350-15/465508912_578579941371784_8448727475936290268_n.jpg?stp=dst-jpg_e15&_nc_ht=scontent-lga3-2.cdninstagram.com&_nc_cat=104&_nc_ohc=UvB9wi5cK-EQ7kNvgFeb85U&_nc_gid=6689ade6e1c94196941c05089512edda&edm=AOQ1c0wBAAAA&ccb=7-5&oh=00_AYCRBywPeMBMbsIDmxYRuYzHDLjZ3X5lBKsmkN5gjr4CvQ&oe=673337BB&_nc_sid=8b3546,1119,False,1730674920,9112,,,,"['Está chegando a aula, e estou preparando o conteúdo com carinho. Quem ainda acha que professor não trabalha aos finais de semana? O tema vocês já estão acompanhando nas últimas semanas: a Bíblia. O livro que mais leio e releio. Há milênios, ele inspira artistas e serve de referência — até mesmo para aqueles que não acreditam.\n\nNeste pequeno vídeo, respondo à pergunta mais simples: Afinal, o que é a Bíblia? Em 1 minuto, busco instigar o interesse de vocês sobre o assunto. \n\nQuer saber mais? Quer mergulhar no livro mais importante do Ocidente?\n\nComente “aula” se quiser receber o link da aula. Será no meu canal, nesta terça-feira, dia 05/11, às 20h. E será também o lançamento de nossa nova comunidade, um espaço para quem tem curiosidade intelectual e respeito, onde exploraremos juntos esse texto milenar.']"
3492720116647679561,5481270177,,DB4onDcpVZJ,https://scontent-lga3-2.cdninstagram.com/v/t51.29350-15/465273580_2398264270519780_7552994499071354367_n.jpg?stp=dst-jpg_e15&_nc_ht=scontent-lga3-2.cdninstagram.com&_nc_cat=104&_nc_ohc=Cj1tSxiAtmwQ7kNvgEtplaW&_nc_gid=6689ade6e1c94196941c05089512edda&edm=AOQ1c0wBAAAA&ccb=7-5&oh=00_AYBCreFrUE1XZUOeegMEGxndSs0xvAfgVtTw5HIscs7VXg&oe=6733207F&_nc_sid=8b3546,9658,False,1730584990,64298,,,,"['A Bíblia é repleta de metáforas e alegorias, servindo não apenas como um relato factual, mas como um livro de lições profundas para aqueles que buscam refletir sobre a vida e a espiritualidade. Por exemplo, a história da Arca de Noé pode ser interpretada simbolicamente, mostrando a preservação da criação e a esperança, em vez de ser compreendida como um evento literal com todos os detalhes exatos. Assim como Jesus usava parábolas e comparações para ilustrar conceitos complexos — como ao dizer “Eu sou o bom pastor” ou “o reino de Deus é como um grão de mostarda” — a Bíblia oferece muitas imagens que nos convidam a pensar além do literal.\n\nSe você deseja participar de uma conversa sobre esses temas, convido você para uma aula aberta e ao vivo que darei no dia 5 de novembro.\n\nAo final, apresentarei a nova comunidade “Bíblia para Quem Crê ou Não Crê” — um espaço criado para o diálogo respeitoso e a análise crítica, aberto a todos, independentemente de crença.']"
3491966407449879283,5481270177,,DB19PJDpaLz,https://scontent-lga3-1.cdninstagram.com/v/t51.2885-15/465078996_18344405338182178_5332413308927620224_n.jpg?stp=dst-jpg_e15&_nc_ht=scontent-lga3-1.cdninstagram.com&_nc_cat=110&_nc_ohc=3jb1MtNOghoQ7kNvgFt3gix&_nc_gid=6689ade6e1c94196941c05089512edda&edm=AOQ1c0wBAAAA&ccb=7-5&oh=00_AYBokzSyQ-SGRD1NBEGV5K668euVyMeht28W1Sh4UIkL8A&oe=673328D7&_nc_sid=8b3546,914,False,1730494800,26121,,,,"['A cena é no Paraná, 1981. Eu era um jovem noviço jesuíta de 18 anos, na paróquia Nossa Senhora da Paz, no Boqueirão, em Curitiba. Tinha muita fé e, naquela época, também muito cabelo. Após estudar por três horas, dar aula de catequese para crianças que estavam se preparando para a Primeira Comunhão e ajudar no orfanato das freiras italianas da região, eu me preparava para uma hora de trabalho plantando. Minha vida religiosa foi marcada pela alegria e pela Bíblia, que eu decorava e recitava salmos enquanto trabalhava. Até hoje, surpreendo-me cantando em gregoriano ao lavar a louça. Essas experiências fazem parte de mim, e as respeito profundamente.\n\nNo dia 5 de novembro, quero convidar você para uma aula ao vivo sobre a Bíblia. Não vamos tratá-la apenas como um texto religioso, mas como uma obra essencial para entender o Ocidente e nossa cultura. Ao final da aula, vou apresentar minha nova comunidade, “Bíblia para Quem Crê ou Não Crê”, um espaço de diálogo aberto para todos que queiram refletir sobre a importância desse livro, independentemente de suas crenças.']"
3491724033746384430,5481270177,,DB1GII9JbYu,https://scontent-lga3-1.cdninstagram.com/v/t51.2885-15/465487564_18344356048182178_6101855731714879236_n.jpg?stp=dst-jpg_e15&_nc_ht=scontent-lga3-1.cdninstagram.com&_nc_cat=110&_nc_ohc=sZZNbTmOaP4Q7kNvgHqNQaZ&_nc_gid=6689ade6e1c94196941c05089512edda&edm=AOQ1c0wBAAAA&ccb=7-5&oh=00_AYDFEvus7ipWoZYYgo_TsCLh6cbHL6_SlbGnZ6WfBvAODw&oe=673328D8&_nc_sid=8b3546,211,False,1730465963,7937,,,,"['Dia atípico em Brasília. Por quê? A cidade estava com chuva leve. Eu ostentava  enorme cicatriz na garganta pela cirurgia recente. De repente,  o público: entusiasmado,afetivo,  vibrante. Eu me esqueço da cirurgia e me entrego a esta experiência de comunicação. Quero que as pessoas pensem, que riam, que encontrem ideias,  que tomem decisões para o universo delas. Quero fazer diferença!  Quase uma hora depois,  saio do palco. Então me lembro que a cicatriz está incomodando. Essa é a experiência de amar o que se faz e se entregar ao momento. Sou feliz.']"
3491154394213522741,5481270177,,DBzEmyzJB01,https://scontent-lga3-1.cdninstagram.com/v/t51.2885-15/465033404_18344246599182178_8652314114402376763_n.jpg?stp=dst-jpg_e35_s1080x1080_sh0.08&_nc_ht=scontent-lga3-1.cdninstagram.com&_nc_cat=110&_nc_ohc=2-vBg7TE1ygQ7kNvgFoxL8F&_nc_gid=6689ade6e1c94196941c05089512edda&edm=AOQ1c0wBAAAA&ccb=7-5&oh=00_AYDCBmkrbdgr3zXa5sCGjmHovz7yKWiKBJ_mM086vTIBVA&oe=67332204&_nc_sid=8b3546,441,False,1730398056,7802,,,,"['Perguntei à MetaIA que surgiu no meu zap quem era Leandro Karnal. Ela começou bem e, depois,  identificou 3 livros que eu jamais escrevi. Adorei O olhar e o vento... Dúvida: a IA sabe sobre futuro?']"
3489798849250568949,5481270177,,DBuQZBLJar1,https://scontent-lga3-1.cdninstagram.com/v/t51.2885-15/464763293_18343980682182178_6387637628645735061_n.jpg?stp=dst-jpg_e15&_nc_ht=scontent-lga3-1.cdninstagram.com&_nc_cat=110&_nc_ohc=6yIe4k3FtVoQ7kNvgHCc8z2&_nc_gid=6689ade6e1c94196941c05089512edda&edm=AOQ1c0wBAAAA&ccb=7-5&oh=00_AYA-flFcV6TMtEn19gMls6RWXouV0ehFFGyrWMdsVOeqxQ&oe=67332135&_nc_sid=8b3546,1640,False,1730236463,31989,,,,"['Post opinativo  meu ( não é um levantamento científico) . Aeroportos do Brasil  a) mais bonito: Floripa. b) entrada mais bonita ( o da foto) Salvador  c) mais difícil  andar dentro : terminal 2 de Guarulhos. d) aeroportos para caminhar quilômetros: Viracopos, Brasília, Confins.  e) mais distantes do centro das capitais: Confins e São Gonçalo do Amarante (RN) f) pouso para testar o esfíncter: Parati. g) pouso mais lindo: Santos Dumont. h) parece que não vai dar para pousar: Serrinha ( Juiz de Fora) e Caxias do Sul. i) café e pão de queijo caros: todos... O que vc corrigiria ou acrescentaria?']"
3489639671110390789,5481270177,,DBtsMq-pVQF,https://scontent-lga3-1.cdninstagram.com/v/t51.29350-15/464750269_572637812105847_2087778762665651508_n.jpg?stp=dst-jpg_e15&_nc_ht=scontent-lga3-1.cdninstagram.com&_nc_cat=103&_nc_ohc=t435S6y0k_kQ7kNvgEkVDDk&_nc_gid=6689ade6e1c94196941c05089512edda&edm=AOQ1c0wBAAAA&ccb=7-5&oh=00_AYBRg1j5UHiIiYRVhFtjAAMoWVHPHSgnd8QHU4cEnqpVbg&oe=67333321&_nc_sid=8b3546,386,False,1730217586,4801,,,,"['Se quisermos uma origem bíblica para os conflitos no Oriente Médio, especialmente uma origem simbólica, podemos olhar para Abraão, patriarca de três grandes tradições religiosas: o judaísmo, o cristianismo e o islamismo. Abraão teve seu primogênito, Ismael, com Hagar, e mais tarde, Isaac, com sua esposa Sara. No entanto, a história conta que Abraão enviou Hagar e Ismael para o deserto, permanecendo com Isaac, o segundo filho. Assim, filhos de um mesmo pai foram separados por circunstâncias e pelo peso de uma herança disputada. Essa separação ancestral parece ecoar nos conflitos de hoje, onde os descendentes desses irmãos simbolicamente ainda disputam identidade, território e legado. É como se, até hoje, os filhos de Abraão lutassem pela mesma herança.\n\nSe você se interessa por reflexões como essa, no dia 5 de novembro farei uma aula ao vivo sobre a Bíblia. E ao final, vou lançar a comunidade “Bíblia para Quem Crê ou Não Crê”, um espaço aberto e respeitoso onde todos podem debater e aprender juntos.\n\nPara saber mais, clique no link da bio']"
3488431834266881098,5481270177,,DBpZkVQpExK,https://scontent-lga3-2.cdninstagram.com/v/t51.29350-15/464738676_385997141146285_7047543925818059280_n.jpg?stp=dst-jpg_e15&_nc_ht=scontent-lga3-2.cdninstagram.com&_nc_cat=101&_nc_ohc=UgHOHIU4HxAQ7kNvgExoE4a&_nc_gid=6689ade6e1c94196941c05089512edda&edm=AOQ1c0wBAAAA&ccb=7-5&oh=00_AYB2bPvVnJKVzVtO4xnOTHLv5fqQ_utxNhQEaKK3h4zIZg&oe=673327F6&_nc_sid=8b3546,4348,False,1730073603,18984,,,,"['No dia 5 de novembro, darei a aula ao vivo “Bíblia: O Livro que Definiu o Ocidente”. Um espaço aberto para todos, independentemente de crenças religiosas. \n\nComente ‘Bíblia’ para fazer a sua inscrição gratuitamente']"
3191021363803860850,1659918613,,CxIyQYMNi9y,https://scontent-lga3-2.cdninstagram.com/v/t51.2885-15/378450794_1621804381676820_6884150764219129750_n.jpg?stp=dst-jpg_e15&_nc_ht=scontent-lga3-2.cdninstagram.com&_nc_cat=100&_nc_ohc=gumvCdFX6yoQ7kNvgFbP0VW&_nc_gid=41d5ea5d73cf42daa563b5da84700902&edm=AOQ1c0wBAAAA&ccb=7-5&oh=00_AYDg8Z6cUk81OjQ2u9aLxtAorkaUG0gTnrO1hwrvaPzB3w&oe=67333B02&_nc_sid=8b3546,12711,False,1694619520,1506900,,,,['Which is your favourite?']
3159850468197213263,1659918613,,CvaC0JcPyRP,https://scontent-lga3-2.cdninstagram.com/v/t51.2885-15/364341748_1683517832096712_5895161318891922979_n.jpg?stp=dst-jpg_e15&_nc_ht=scontent-lga3-2.cdninstagram.com&_nc_cat=100&_nc_ohc=-Re8fOGcn-0Q7kNvgFDjE2R&_nc_gid=41d5ea5d73cf42daa563b5da84700902&edm=AOQ1c0wBAAAA&ccb=7-5&oh=00_AYC2yLUp8GbgALbgi20rJbfpremWlNdhseI3okUFun7oXQ&oe=67331A46&_nc_sid=8b3546,9691,False,1690903637,900734,,,,['Which is your favourite?']
3496101282567329099,1659918613,,DCEpZfmNpVL,https://scontent-lga3-2.cdninstagram.com/v/t51.29350-15/466130045_3854295784785457_4691909170171534905_n.jpg?stp=dst-jpg_e15&_nc_ht=scontent-lga3-2.cdninstagram.com&_nc_cat=101&_nc_ohc=ubNEsosSESsQ7kNvgG2g5sw&_nc_gid=41d5ea5d73cf42daa563b5da84700902&edm=AOQ1c0wBAAAA&ccb=7-5&oh=00_AYCF6QICfukSouNCxSA9IfSlGfsfY2cIE5TdQvXNr8wvrA&oe=67332C20&_nc_sid=8b3546,18,False,1730987934,917,,,,['1. Vexing = Making somebody annoyed or worried\n2. Pestilential = Extremely annoying\n3. Exasperating = Extremely annoying']
3495313343151199540,1659918613,,DCB2Pd1NdU0,https://scontent-lga3-2.cdninstagram.com/v/t51.29350-15/465909282_563174039535144_1687025398970453058_n.jpg?stp=dst-jpg_e15&_nc_ht=scontent-lga3-2.cdninstagram.com&_nc_cat=100&_nc_ohc=FRIPfRSK1nAQ7kNvgG6-NkF&_nc_gid=41d5ea5d73cf42daa563b5da84700902&edm=AOQ1c0wBAAAA&ccb=7-5&oh=00_AYDE5127BwlMQyPUFJbfdDeVAW7c1LbL8v1NQ317lBwFyA&oe=673322E8&_nc_sid=8b3546,20,False,1730893910,2038,,,,['I’m terribly apologetic; I’m presently otherwise engaged.']
3494877401043068644,1659918613,,DCATHrGtmbk,https://scontent-lga3-2.cdninstagram.com/v/t51.29350-15/465803558_1246559299725009_5984311125592624769_n.jpg?stp=dst-jpg_e15&_nc_ht=scontent-lga3-2.cdninstagram.com&_nc_cat=109&_nc_ohc=q9BgZGaRnRcQ7kNvgGqtg0p&_nc_gid=41d5ea5d73cf42daa563b5da84700902&edm=AOQ1c0wBAAAA&ccb=7-5&oh=00_AYCjlwsEZv-uWA78Qvs2L8HrNJNdVHL58HdX47Fp2WmAWQ&oe=67332DAA&_nc_sid=8b3546,32,False,1730842095,2371,,,,['Take a leaf out of my book 📖']
3494010979404400132,1659918613,,DB9OHlEtsYE,https://scontent-lga3-1.cdninstagram.com/v/t51.29350-15/465753010_516403927888491_2365986685659784839_n.jpg?stp=dst-jpg_e15_fr_p1080x1080&_nc_ht=scontent-lga3-1.cdninstagram.com&_nc_cat=103&_nc_ohc=tVZhwiXLiJEQ7kNvgFNjjUs&_nc_gid=41d5ea5d73cf42daa563b5da84700902&edm=AOQ1c0wBAAAA&ccb=7-5&oh=00_AYBuspIh0LiztBEBmlBStBYy1DMXsbf-bPbf3x5paz88gg&oe=673318AD&_nc_sid=8b3546,117,False,1730738637,6737,,,,['What is your English level?']
3492542562021208812,1659918613,,DB4APS0NPLs,https://scontent-lga3-1.cdninstagram.com/v/t51.29350-15/465569156_1066135958155491_6289768817780876483_n.jpg?stp=dst-jpg_e15_fr_p1080x1080&_nc_ht=scontent-lga3-1.cdninstagram.com&_nc_cat=103&_nc_ohc=CQ98z-NOFRoQ7kNvgF98D1n&_nc_gid=41d5ea5d73cf42daa563b5da84700902&edm=AOQ1c0wBAAAA&ccb=7-5&oh=00_AYDOkTjKn-RsC766Lkb0cHuIGTjO1p39bina-ryucbnJ6w&oe=67333704&_nc_sid=8b3546,3246,False,1730564106,246069,,,,['What are you?']
3489421028847123348,1659918613,,DBs6fAgNfuU,https://scontent-lga3-2.cdninstagram.com/v/t51.29350-15/464998727_479924755070253_4476507957465896361_n.jpg?stp=dst-jpg_e15_fr_p1080x1080&_nc_ht=scontent-lga3-2.cdninstagram.com&_nc_cat=109&_nc_ohc=0rSDszAlHfcQ7kNvgHth69b&_nc_gid=41d5ea5d73cf42daa563b5da84700902&edm=AOQ1c0wBAAAA&ccb=7-5&oh=00_AYDHik0QEqltWzGle13nMqyj27SZlSr_A3lnkuG42gkF4g&oe=67330D8D&_nc_sid=8b3546,106,False,1730191540,10373,,,,"['*If someone is brave because they are not afraid of taking risks, you can use the adjectives daring or bold.\n\n*A fearless person has no fear. Dauntless and intrepid are more formal words with the same meaning that are found mainly in literature.\n\n*Venturesome is used to describe a person who is willing to take risks, or an action or behaviour that involves risks.']"
3479566114163527996,1659918613,,DBJ5vH_NBE8,https://scontent-lga3-1.cdninstagram.com/v/t51.29350-15/463295245_326467910547927_2709991263229885445_n.jpg?stp=dst-jpg_e15&_nc_ht=scontent-lga3-1.cdninstagram.com&_nc_cat=103&_nc_ohc=qxNlcUW-SVQQ7kNvgG5m5ie&_nc_gid=41d5ea5d73cf42daa563b5da84700902&edm=AOQ1c0wBAAAA&ccb=7-5&oh=00_AYBzoS-AN2dXjr3Q04TS8Eq3jU-5yh4XTAoREyG0NBuXVg&oe=67332FB8&_nc_sid=8b3546,131,False,1729016658,14502,,,,['FORTHWITH!']
3477457600163330498,1659918613,,DBCaUNTN7nC,https://scontent-lga3-2.cdninstagram.com/v/t51.29350-15/463019256_556278037081288_9072728154496790520_n.jpg?stp=dst-jpg_e15&_nc_ht=scontent-lga3-2.cdninstagram.com&_nc_cat=104&_nc_ohc=H0OT6rd0kxcQ7kNvgFMsJVE&_nc_gid=41d5ea5d73cf42daa563b5da84700902&edm=AOQ1c0wBAAAA&ccb=7-5&oh=00_AYCoQGFrEgCqWXjofker8ctQm_GmTjtf4YX03y86SWVoLw&oe=673330CB&_nc_sid=8b3546,228,False,1728765449,29795,,,,['Which is your favourite?']
3473751129646865541,1659918613,,DA1Pj9otpyF,https://scontent-lga3-1.cdninstagram.com/v/t51.29350-15/462252630_531477629477446_6474388302659405488_n.jpg?stp=dst-jpg_e15&_nc_ht=scontent-lga3-1.cdninstagram.com&_nc_cat=110&_nc_ohc=cBy8Qiam9TEQ7kNvgEMCBuE&_nc_gid=41d5ea5d73cf42daa563b5da84700902&edm=AOQ1c0wBAAAA&ccb=7-5&oh=00_AYDqOB0t64RUaQ_k_VCskG5imqoBqfLsqHaKiPcNCWOjUQ&oe=67331CDA&_nc_sid=8b3546,171,False,1728323502,19886,,,,['Do you know any more?']
