video_id,user_id,title,shortcode,thumb,url,views,comments_count,comments_disabled,taken_at,likes,location,duration,captions
2850329201715090591,271698321,,CeOZ06pJpSf,https://scontent-lga3-2.cdninstagram.com/v/t51.2885-15/284716909_112674714791041_3690808854775894175_n.jpg?stp=dst-jpg_e15&_nc_ht=scontent-lga3-2.cdninstagram.com&_nc_cat=101&_nc_ohc=OaqTquyivywQ7kNvgH4FTc-&_nc_gid=9776f66361f94a09a0abe1ca305e7b8f&edm=AOQ1c0wBAAAA&ccb=7-5&oh=00_AYDF02XXhlFrcrZQOAKh6J_WyW7_JOygOKfs8jkMbK7Hfw&oe=67333AAD&_nc_sid=8b3546,https://scontent-lga3-2.cdninstagram.com/o1/v/t16/f2/m69/AQNiZ3bsBYGK0bZ3Liy9Uir7-JBIOISZf4cARmMu8n-sLwEsf741XRHPfgQAb3D7n0U6AJ6sFIjMUDt3O68SNnOd.mp4?stp=dst-mp4&efg=eyJxZV9ncm91cHMiOiJbXCJpZ193ZWJfZGVsaXZlcnlfdnRzX290ZlwiXSIsInZlbmNvZGVfdGFnIjoidnRzX3ZvZF91cmxnZW4uaWd0di5jMi43MjAuYmFzZWxpbmUifQ&_nc_cat=100&vs=1161048391135029_3027527880&_nc_vs=HBksFQIYOnBhc3N0aHJvdWdoX2V2ZXJzdG9yZS9HTWJlOWhCVmxDZF9SeDRFQUpFTENIMWh0WXdQYnZWQkFBQUYVAALIAQAVAhg6cGFzc3Rocm91Z2hfZXZlcnN0b3JlL0dJbmNBaEZaMDhyTXBIZ0FBR3B5SE1YbV85bEdidlZCQUFBRhUCAsgBACgAGAAbAYgHdXNlX29pbAExFQAAJtDI1qTA5uk%2FFQIoAkMzLBdAMTMzMzMzMxgSZGFzaF9iYXNlbGluZV8xX3YxEQB17AcA&_nc_rid=9776f8ed27&ccb=9-4&oh=00_AYD8R3Yo5IDBzdFBWqNVfqcfFs49wjsdlnlasJVpzWL-qQ&oe=672F1F56&_nc_sid=8b3546,939790,472,False,1654005840,124926,,17.2,"[""Kira-kira kalo teori Multiverse tuh bener, di multiverse lain aku jadi apa yaa.. mungkin Jerome yang kalem?? WKWKWK😂 pernah kepikiran gak sih?!\n\nOiya, Doctor Strange in the Multiverse of Madness udah tayang lama banget, tapi aku belum sempet nonton! Pasti seru banget sih ini🥲\n\nNah kira-kira apa nih versi multiverse dari kalian? Coba komen di bawah yaah! \n\nBtw siapa nih yang udah nonton Marvel Studios' Doctor Strange in the Multiverse of Madness? Fixxx sebelum filmnya abis di bioskop, aku harus nonton!!! #UnleashTheMultiverse #DoctorStrangeID\n@marvelindonesia""]"
2815207730705775058,271698321,,CcRoIP1prnS,https://scontent-lga3-1.cdninstagram.com/v/t51.2885-15/278237609_1203106840227267_1933404783065201104_n.jpg?stp=dst-jpg_e15&_nc_ht=scontent-lga3-1.cdninstagram.com&_nc_cat=103&_nc_ohc=3hmCbbYd-SAQ7kNvgGznMh9&_nc_gid=9776f66361f94a09a0abe1ca305e7b8f&edm=AOQ1c0wBAAAA&ccb=7-5&oh=00_AYD0ooIUt_t5Wl_VKIDhsjuKP-HFquzRF-tYPu7V7LpBwA&oe=673327C6&_nc_sid=8b3546,https://scontent-lga3-2.cdninstagram.com/o1/v/t16/f2/m69/AQNVWaYvjqu6eKtAQ6fEadGuMlW-i5zL8n5BDoENOI6q8qjta1Poy_avi9Ju4veMlMsR9Nd9Y4fqnydf5A6XLXo_.mp4?stp=dst-mp4&efg=eyJxZV9ncm91cHMiOiJbXCJpZ193ZWJfZGVsaXZlcnlfdnRzX290ZlwiXSIsInZlbmNvZGVfdGFnIjoidnRzX3ZvZF91cmxnZW4uaWd0di5jMi43MjAuYmFzZWxpbmUifQ&_nc_cat=101&vs=3156103158044702_2499360741&_nc_vs=HBksFQIYOnBhc3N0aHJvdWdoX2V2ZXJzdG9yZS9HSlJDbWhDQVYxWV9LeElCQUExT05tcFVxd1VnYnZWQkFBQUYVAALIAQAVAhg6cGFzc3Rocm91Z2hfZXZlcnN0b3JlL0dMQjJtaENDQnJEZXFkd0NBUHhhamV3TU9xY3FidlZCQUFBRhUCAsgBACgAGAAbAYgHdXNlX29pbAExFQAAJobd07vNrddAFQIoAkMzLBdAScQ5WBBiThgSZGFzaF9iYXNlbGluZV8xX3YxEQB17AcA&_nc_rid=9776fac60b&ccb=9-4&oh=00_AYAqP-GrgqyuLwc8E83vwjgEETJWPmeRDka3iasqxPLdHw&oe=672F2118&_nc_sid=8b3546,1174743,589,False,1649819122,193347,,51.533,"['Ini hasil shooting iklan waktu itu bareng kak dian sastro dan kak vino, WAZEKKK😂😂\n\nBtw guys, kalian inget gak sama tweet aku yg 3K challenge? Bikin konten adalah caraku untuk ikutan tantangan ini.\n\nNah aku mau lanjutin nih, mumpung dikasih tantangan sama kak @therealdisastr lewat fitur Group Challenge #GalaxyWatch4 Series untuk switch on my best mode.\n\nDengan ngelakuin ini, aku bisa belajar banyak hal baru, salah satunya olahraga. Yaa walaupun gak terlalu jago di bidang ini, tapi yang penting tetep berprogres. Soal matematika aja bisa aku selesain, masa ini engga😂😂\n\nMakanya aku harus fokus sama target dan tujuan awal. Biar bisa buat konten sambil olahraga, aku pakai #GalaxyBuds2 yang punya fitur Active Noise Cancellation dan Ambient Mode, jadi bisa fokus dengan target dan tetap peka dengan sekitar.\n\nGak cuma itu, untuk liat seberapa dekat dengan target yang mau aku capai, aku pake fitur Steps Tracker yang ada di #GalaxyWatch4 Series. Terus kalo nyasar aku gak akan khawatir karena ada fitur Maps Direction. Jadi lebih mudah buat nentuin arah. If I can do it, so do you!🤩\n\nChoose your own way to be better every day and let’s #TurnOnTheBestYou together! Muantap jiwaaaa🔥']"
2800209965231654796,271698321,,CbcWCCSJEeM,https://scontent-lga3-2.cdninstagram.com/v/t51.2885-15/276963117_1158173464998513_6287517918525818436_n.jpg?stp=dst-jpg_e15&_nc_ht=scontent-lga3-2.cdninstagram.com&_nc_cat=109&_nc_ohc=Hr-UsoC4Ub8Q7kNvgEP35FU&_nc_gid=9776f66361f94a09a0abe1ca305e7b8f&edm=AOQ1c0wBAAAA&ccb=7-5&oh=00_AYDjdDgItcNtljmSeIg95FFcjIVyDmLqKDweFJ-hE39F0w&oe=67332185&_nc_sid=8b3546,https://scontent-lga3-1.cdninstagram.com/o1/v/t16/f2/m69/AQO55qDsp6Dz_ol92JqHFS8Jjs5x4v-UVGEj7VosUR5NYk1oHGl2OdDMSKHLOL93OV2l3F_IIy_uPWuB3HWSjvEe.mp4?stp=dst-mp4&efg=eyJxZV9ncm91cHMiOiJbXCJpZ193ZWJfZGVsaXZlcnlfdnRzX290ZlwiXSIsInZlbmNvZGVfdGFnIjoidnRzX3ZvZF91cmxnZW4uaWd0di5jMi43MjAuYmFzZWxpbmUifQ&_nc_cat=110&vs=520374722771458_4135490597&_nc_vs=HBksFQIYOnBhc3N0aHJvdWdoX2V2ZXJzdG9yZS9HTFhnZ2hEd3pTUFJ2aU1MQUEyd0ZOd1J4VTl3YnZWQkFBQUYVAALIAQAVAhg6cGFzc3Rocm91Z2hfZXZlcnN0b3JlL0dPWnlneERyaFpFTVpRc0tBSC1IZEpic1pQZDVidlZCQUFBRhUCAsgBACgAGAAbAYgHdXNlX29pbAExFQAAJvrn3oDXyck%2FFQIoAkMzLBdAPQhysCDEnBgSZGFzaF9iYXNlbGluZV8xX3YxEQB17AcA&_nc_rid=9776f2ee90&ccb=9-4&oh=00_AYAuXUQE-WUJ3cD_nKYt5panLd7bkFZEfi2nKL_n7Vf1kA&oe=672F45BB&_nc_sid=8b3546,718125,191,False,1648032683,78155,,29.033,"['Tiap kali inget mama papa, pasti selalu kepikiran harus berbuat apalagi untuk ngebales jasa2 mereka🥲\n\nWalaupun aku tau jasa mama papa ga pernah bisa terbalaskan dengan apapun, aku dan Bang Ian tetep berusaha buat mikirin masa tua mama dan papa. Salah satunya dengan nyiapin dana pensiun, kayak yang waktu aku ceritain di YouTube. \n\nAku ngerasa tenang bgt semenjak kenal @bibit.id karna aku bisa investasi buat dana pensiun mama papa. Seneng bgt karna dengan investasi, dananya jadi lebih cepet berkembang dan lebih cepet juga tercapai targetnya.\n\nsemoga apa yang aku sama Bang Ian lakuin ini bisa berguna untuk mama papa di masa tua🤗❤️']"
2752476295376345364,271698321,,CYywpt-lxkU,https://scontent-lga3-2.cdninstagram.com/v/t51.29350-15/271876050_1599556157078080_7363134136369159826_n.jpg?stp=dst-jpg_e15&_nc_ht=scontent-lga3-2.cdninstagram.com&_nc_cat=104&_nc_ohc=xnKmG1GCWToQ7kNvgEp9qqj&_nc_gid=9776f66361f94a09a0abe1ca305e7b8f&edm=AOQ1c0wBAAAA&ccb=7-5&oh=00_AYBxH1eYuvdDpLMc7ecVzhlWyDK7y6gajVNZqhblQdV70g&oe=673315B3&_nc_sid=8b3546,https://scontent-lga3-2.cdninstagram.com/o1/v/t16/f2/m69/AQM5km9Zs9axzp6_xOrUzwiA6313zxfn3x_xzQXaKZAW-vMcQGr4pZ2PY5vj8gbT0_QqJSnQKFb5sO9eUjTwmL7N.mp4?stp=dst-mp4&efg=eyJxZV9ncm91cHMiOiJbXCJpZ193ZWJfZGVsaXZlcnlfdnRzX290ZlwiXSIsInZlbmNvZGVfdGFnIjoidnRzX3ZvZF91cmxnZW4uaWd0di5jMi43MjAuYmFzZWxpbmUifQ&_nc_cat=104&vs=321533039856302_1024179875&_nc_vs=HBksFQIYOnBhc3N0aHJvdWdoX2V2ZXJzdG9yZS9HSUNXbUFCWWhmbjlLcndEQUFYcEVIc2tKRzFNYnZWQkFBQUYVAALIAQAVAhg6cGFzc3Rocm91Z2hfZXZlcnN0b3JlL0dQVi1OaERxZVdsUlBpNEJBT01zSzJsRVNtd3RidlZCQUFBRhUCAsgBACgAGAAbAYgHdXNlX29pbAExFQAAJsqD5KLUrds%2FFQIoAkMzLBdAUu7peNT99BgSZGFzaF9iYXNlbGluZV8xX3YxEQB17AcA&_nc_rid=9776f4e1a7&ccb=9-4&oh=00_AYAy29WJ6ScvN6WjAs-aRxNcJeQdcWTtnSdH1oWjvfQG-A&oe=672F1AF5&_nc_sid=8b3546,1442238,1659,False,1642340858,225857,,75.733,"['Beberapa hari lalu aku dapet soal UTBK ini dari followers yg ngedm, karena aku iseng yaudah aku coba bikin video pembahasan😂 HAHAHA!\n\nSeru bgt ya ngerjain soal2 matematika.. Semoga bermanfaat! Silakan save dan share~ MANTAPPUJIWA 🔥 #jeromebahassoal']"
2711694231434790356,271698321,,CWh34lMJYXU,https://scontent-lga3-2.cdninstagram.com/v/t51.29350-15/259799518_310857790651956_813430486883572203_n.jpg?stp=dst-jpg_e35&_nc_ht=scontent-lga3-2.cdninstagram.com&_nc_cat=100&_nc_ohc=QPY6QjxbrfUQ7kNvgE3gEs9&_nc_gid=9776f66361f94a09a0abe1ca305e7b8f&edm=AOQ1c0wBAAAA&ccb=7-5&oh=00_AYDN7Wy-U52Oqy0xCLNiIh_3ejdrf6QEwC26PX_PafjD9A&oe=67331AF6&_nc_sid=8b3546,https://scontent-lga3-1.cdninstagram.com/o1/v/t16/f1/m84/214C07AE8FD3B1BB6D16E15371C0C8B0_video_dashinit.mp4?stp=dst-mp4&efg=eyJxZV9ncm91cHMiOiJbXCJpZ193ZWJfZGVsaXZlcnlfdnRzX290ZlwiXSIsInZlbmNvZGVfdGFnIjoidnRzX3ZvZF91cmxnZW4uaWd0di5jMi44OTguYmFzZWxpbmUifQ&_nc_cat=108&vs=24126069510342292_2844382365&_nc_vs=HBksFQIYTGlnX2JhY2tmaWxsX3RpbWVsaW5lX3ZvZC8yMTRDMDdBRThGRDNCMUJCNkQxNkUxNTM3MUMwQzhCMF92aWRlb19kYXNoaW5pdC5tcDQVAALIAQAVAhg6cGFzc3Rocm91Z2hfZXZlcnN0b3JlL0dFZU9vQmZ6LVRQRDhiRUpBQUxTVW5LR19URi1icGt3QUFBRhUCAsgBACgAGAAbAYgHdXNlX29pbAExFQAAJvalwqTg0PU%2FFQIoAkMzLBdASohysCDEnBgSZGFzaF9iYXNlbGluZV8xX3YxEQB17AcA&_nc_rid=9776f66ac7&ccb=9-4&oh=00_AYBvPzp3wO44ogIiGawIGx2CcjPujSMO5Bf5fnUdQh4k5Q&oe=672F4526&_nc_sid=8b3546,2096123,3333,False,1637479279,474197,,53.066,"['Ada sebuah cerita yang mungkin belom pernah aku ceritain ke kalian secara detail. Cerita tentang perjuangan mewujudkan mimpi sejak SD, yaitu pergi ke Disney Land.\n\nHari ini aku mau ceritain di youtube. Jam 17.00 WIB yah!!']"
2701499232600647239,271698321,,CV9pz0oJuZH,https://scontent-lga3-2.cdninstagram.com/v/t51.29350-15/253622480_131190639276293_3981834235631746537_n.jpg?stp=dst-jpg_e35&_nc_ht=scontent-lga3-2.cdninstagram.com&_nc_cat=105&_nc_ohc=xR0mrCsSIx0Q7kNvgEHSTU9&_nc_gid=9776f66361f94a09a0abe1ca305e7b8f&edm=AOQ1c0wBAAAA&ccb=7-5&oh=00_AYAnexcS0gw7Ghzp48jI73HtTUwPhVJhHHlgLY0J8yEPoQ&oe=67331A08&_nc_sid=8b3546,https://scontent-lga3-1.cdninstagram.com/o1/v/t16/f1/m84/5242AD67AAAAFBC1CDF67C8266158F80_video_dashinit.mp4?stp=dst-mp4&efg=eyJxZV9ncm91cHMiOiJbXCJpZ193ZWJfZGVsaXZlcnlfdnRzX290ZlwiXSIsInZlbmNvZGVfdGFnIjoidnRzX3ZvZF91cmxnZW4uaWd0di5jMi43MjAuYmFzZWxpbmUifQ&_nc_cat=103&vs=340355025222086_2724313779&_nc_vs=HBksFQIYTGlnX2JhY2tmaWxsX3RpbWVsaW5lX3ZvZC81MjQyQUQ2N0FBQUFGQkMxQ0RGNjdDODI2NjE1OEY4MF92aWRlb19kYXNoaW5pdC5tcDQVAALIAQAVAhg6cGFzc3Rocm91Z2hfZXZlcnN0b3JlL0dOWGZDaGR2WlFSSkdKVUFBQkhiZFN6VWdQTnlicGt3QUFBRhUCAsgBACgAGAAbAYgHdXNlX29pbAExFQAAJuam%2Bqvuw88%2FFQIoAkMzLBdARszMzMzMzRgSZGFzaF9iYXNlbGluZV8xX3YxEQB17AcA&_nc_rid=9776f88c88&ccb=9-4&oh=00_AYBMSNwRlbcFXjqUd8TD0Bi1MU40FAxSZWFTLceZqhqN-w&oe=672F4D63&_nc_sid=8b3546,1266261,3100,False,1636263954,265573,,45.6,"['Salah satu konten yang idenya aku udah pikirin dari tahun lalu! Setelah berbagai persiapan, baru bisa dieksekusi sekarang… QUIZ BARENG YOUTUBER & INFLUENCER INDONESIA!!\n\nUntuk yg pertama, QUIZ MATEMATIKA!😂 Bintang tamu kali ini adalah @fadiljaidi @bintangemon @gadgetins @alshadahmad @hansoljang110 @kenandgrat !! SERU BANGEETT!!\n\nRencana kedepannya sih bakal ada berbagai macam topik, dan dengan bintang tamu2 lainnya!! Nanti sore/malem aku upload yaa!! Semoga mantap jiwaa 🤩🙏🏻']"
2677011597534675745,271698321,Tentang 5 Oktober dan pulang ke Indonesia.,CUmp91Sp8Mh,https://scontent-lga3-1.cdninstagram.com/v/t51.29350-15/244383690_242024247936380_3638180109779783221_n.jpg?stp=dst-jpg_e35&_nc_ht=scontent-lga3-1.cdninstagram.com&_nc_cat=108&_nc_ohc=eArBwDXqhB8Q7kNvgGrpqT2&_nc_gid=9776f66361f94a09a0abe1ca305e7b8f&edm=AOQ1c0wBAAAA&ccb=7-5&oh=00_AYCuS-vuxQHGe0p768gT-b183Mag-b2zU-b0E6wslNPsnQ&oe=67330DF5&_nc_sid=8b3546,https://scontent-lga3-1.cdninstagram.com/o1/v/t16/f1/m84/D24D3C6A8AA34CDEB7000C7504188BAD_video_dashinit.mp4?stp=dst-mp4&efg=eyJxZV9ncm91cHMiOiJbXCJpZ193ZWJfZGVsaXZlcnlfdnRzX290ZlwiXSIsInZlbmNvZGVfdGFnIjoidnRzX3ZvZF91cmxnZW4uaWd0di5jMi43MjAuYmFzZWxpbmUifQ&_nc_cat=108&vs=893551882207065_1182160950&_nc_vs=HBksFQIYTGlnX2JhY2tmaWxsX3RpbWVsaW5lX3ZvZC9EMjREM0M2QThBQTM0Q0RFQjcwMDBDNzUwNDE4OEJBRF92aWRlb19kYXNoaW5pdC5tcDQVAALIAQAVAhg6cGFzc3Rocm91Z2hfZXZlcnN0b3JlL0dNUFdyaGJPS25MZVZlZ0JBRkEzbWs0VXlfTVVicGt3QUFBRhUCAsgBACgAGAAbAYgHdXNlX29pbAExFQAAJu7Qybeio71AFQIoAkMzLBdAV%2BIcrAgxJxgSZGFzaF9iYXNlbGluZV8xX3YxEQB17AcA&_nc_rid=9776fe7249&ccb=9-4&oh=00_AYCkF_R64UDIKrE6quTvIMRbC7vNBlyTME49Xqd67mIhsg&oe=672F46DA&_nc_sid=8b3546,1241070,1216,False,1633344829,242408,,95.533,"['Akhirnya bakal beneran pulang ke Indonesia, GA SABAR!!']"
2670548666852679871,271698321,LIVE COBA SNACK MENANTEA,CUPsd0DJaC_,https://scontent-lga3-2.cdninstagram.com/v/t51.29350-15/242691741_991552511640529_8523747241016161027_n.jpg?stp=dst-jpg_e35&_nc_ht=scontent-lga3-2.cdninstagram.com&_nc_cat=101&_nc_ohc=L2V13rA4obcQ7kNvgEnMwNn&_nc_gid=9776f66361f94a09a0abe1ca305e7b8f&edm=AOQ1c0wBAAAA&ccb=7-5&oh=00_AYBAkYiKT7-LNmboa0mx6yHkMa1JExUljp2Q_tUS9RaS7Q&oe=67330C5D&_nc_sid=8b3546,https://scontent-lga3-2.cdninstagram.com/o1/v/t16/f2/m69/AQPa6iLkuS984objbDH8VN07YwLJ44pZCHXP9rlpU2zcYLgjUxH9e0feRHpB494dTKE5J1XQbJQCmzhQa4JyETaT.mp4?stp=dst-mp4&efg=eyJxZV9ncm91cHMiOiJbXCJpZ193ZWJfZGVsaXZlcnlfdnRzX290ZlwiXSIsInZlbmNvZGVfdGFnIjoidnRzX3ZvZF91cmxnZW4uaWd0di5jMi43MjAuYmFzZWxpbmUifQ&_nc_cat=100&vs=950430146398257_4046045524&_nc_vs=HBksFQIYOnBhc3N0aHJvdWdoX2V2ZXJzdG9yZS9HSUNXbUFEVEktcWRsVk1CQVBJQlBTX3ZiLU4xYnFDQkFBQUYVAALIAQAVAhg6cGFzc3Rocm91Z2hfZXZlcnN0b3JlL0dJQ1dtQUMySmw2eDRaZ0JBTHVfRDRiYU40aEFicUNCQUFBRhUCAsgBACgAGAAbAYgHdXNlX29pbAExFQAAJorr%2BYXF3dY%2FFQIoAkMzLBdAnYZnbItDlhgSZGFzaF9iYXNlbGluZV8xX3YxEQB17AcA&_nc_rid=9776fb632b&ccb=9-4&oh=00_AYAQEBVSOMY0Bj8sbM9R3iDjaniFONDElmCNjejo1sTqAQ&oe=672F4154&_nc_sid=8b3546,1882737,2212,False,1632574249,346782,,1889.601,"['MAKASIHHH BANYAK total 350k penonton waktu live tadii! Terus tadi jumlah penonton yg nonton barengan, ada sampe 78,9k!! Kalian emang terbaikkk💚💚Sorry yang awal tiba2 livenya berhentii trus ga ke save🥲🥲']"
2582261338829301876,271698321,GA SENGAJA LIVE BARENG KAK ISYANA WOEEEEE WKWKWKWK🥺🥺,CPWCQGaJSh0,https://scontent-lga3-1.cdninstagram.com/v/t51.29350-15/191137938_896407794537366_7233342647929106897_n.jpg?stp=dst-jpg_e35&_nc_ht=scontent-lga3-1.cdninstagram.com&_nc_cat=106&_nc_ohc=kKWCWu503BMQ7kNvgEN6jvv&_nc_gid=9776f66361f94a09a0abe1ca305e7b8f&edm=AOQ1c0wBAAAA&ccb=7-5&oh=00_AYDR8t1yEzOCeRj9glJEZjZIc-kpClPxLsxujMGq5ZmUFg&oe=67333CE4&_nc_sid=8b3546,https://scontent-lga3-1.cdninstagram.com/o1/v/t16/f2/m69/AQMzveb5EUvx5m6rj01oUyLKXLPkVQ3ErcfU_mEhQ8G1Iq8_e7InaB0p6t69zoNZQyHU91ilzaS5zAIAcnIPkDfT.mp4?stp=dst-mp4&efg=eyJxZV9ncm91cHMiOiJbXCJpZ193ZWJfZGVsaXZlcnlfdnRzX290ZlwiXSIsInZlbmNvZGVfdGFnIjoidnRzX3ZvZF91cmxnZW4uaWd0di5jMi43MjAuYmFzZWxpbmUifQ&_nc_cat=103&vs=497073049335718_152547208&_nc_vs=HBksFQIYOnBhc3N0aHJvdWdoX2V2ZXJzdG9yZS9HSUNXbUFDamMxZEZkREFGQU52VWZqdDRGZGRyYnFDQkFBQUYVAALIAQAVAhg6cGFzc3Rocm91Z2hfZXZlcnN0b3JlL0dJMVp2QnFwSS1rWHpKVUJBSzQtZ09ZWndjaDFicUNCQUFBRhUCAsgBACgAGAAbAYgHdXNlX29pbAExFQAAJu6Dkb2f4Mo%2FFQIoAkMzLBdAnDZ41P3zthgSZGFzaF9iYXNlbGluZV8xX3YxEQB17AcA&_nc_rid=9776fed5f8&ccb=9-4&oh=00_AYB9VcMaRj7qjGQcvP82I2Rr3z59cB7pEVkZwC4oMz9jxg&oe=672F1E65&_nc_sid=8b3546,1743856,1255,False,1622049653,346625,,1805.618,['Makasih banyak for making my day kak isyana!! Sampe panas badanku WKWKWKWKWK 😬😬']
2539977166639558399,271698321,"Ngobrol bareng Menteri Pendidikan dan Kebudayaan Indonesia, Pak Nadiem",CM_z8aTJ27_,https://scontent-lga3-2.cdninstagram.com/v/t51.29350-15/165306774_275308684179221_4738420449344817826_n.jpg?stp=dst-jpg_e35&_nc_ht=scontent-lga3-2.cdninstagram.com&_nc_cat=105&_nc_ohc=0IGAaGoJyDAQ7kNvgGT_2FW&_nc_gid=9776f66361f94a09a0abe1ca305e7b8f&edm=AOQ1c0wBAAAA&ccb=7-5&oh=00_AYB4G7A6264mNnByC_1OYW9TddNMwp7YMklXlXkdBwCoOA&oe=673335AC&_nc_sid=8b3546,https://scontent-lga3-2.cdninstagram.com/o1/v/t16/f2/m69/AQPXUe_TSEAzKJZfnRyiycJ4PBBejONjwyrNyqjERGgvERD5jvtkgDfjAKHUw1-cDITUgcngrtPgV2GW_uQ2jRE9.mp4?stp=dst-mp4&efg=eyJxZV9ncm91cHMiOiJbXCJpZ193ZWJfZGVsaXZlcnlfdnRzX290ZlwiXSIsInZlbmNvZGVfdGFnIjoidnRzX3ZvZF91cmxnZW4uaWd0di5jMi43MjAuYmFzZWxpbmUifQ&_nc_cat=107&vs=793436616233379_421422739&_nc_vs=HBksFQIYOnBhc3N0aHJvdWdoX2V2ZXJzdG9yZS9HSUNXbUFEWkpCNVVUWmdCQUI3TTB1Z0t3NDlhYnFDQkFBQUYVAALIAQAVAhg6cGFzc3Rocm91Z2hfZXZlcnN0b3JlL0dOMkpzUnIxRk50Rk02c0NBRkRaa3BQcVluOVBicUNCQUFBRhUCAsgBACgAGAAbAYgHdXNlX29pbAExFQAAJuj3jbzj2M4%2FFQIoAkMzLBdArQRnbItDlhgSZGFzaF9iYXNlbGluZV8xX3YxEQB17AcA&_nc_rid=9776ffc8f6&ccb=9-4&oh=00_AYDAKSiI8F7OKdO0-CIh4gfh0fdcPFssTXeXVJkFX9i57A&oe=672F405E&_nc_sid=8b3546,1997184,5056,False,1617008914,476685,,3714.202,"['Sebuah kehormatan buat aku untuk bisa ngobrol2 langsung dengan Mas Menteri, Pak @nadiemmakarim . Ngobrolin seputar dunia pendidikan bener2 seru!\n\nSemoga pendidikan di Indonesia bisa semakin maju! Mantappu Jiwa🔥']"
2450969170475861579,271698321,Bagaimana syarat sebuah kata masuk ke KBBI?,CIDl3mJpcZL,https://scontent-lga3-1.cdninstagram.com/v/t51.29350-15/127225708_137480344835420_1062576662387951146_n.jpg?stp=dst-jpg_e35&_nc_ht=scontent-lga3-1.cdninstagram.com&_nc_cat=108&_nc_ohc=OHv5k5jhFeUQ7kNvgFRROTk&_nc_gid=9776f66361f94a09a0abe1ca305e7b8f&edm=AOQ1c0wBAAAA&ccb=7-5&oh=00_AYBeKPOld7BnBU-kbFVDWJOCUBZ1EPdZM8hq2UZoGkggeQ&oe=67333719&_nc_sid=8b3546,https://scontent-lga3-1.cdninstagram.com/o1/v/t16/f1/m84/D14CCB97ED7196664DA778F2F96B3781_video_dashinit.mp4?stp=dst-mp4&efg=eyJxZV9ncm91cHMiOiJbXCJpZ193ZWJfZGVsaXZlcnlfdnRzX290ZlwiXSIsInZlbmNvZGVfdGFnIjoidnRzX3ZvZF91cmxnZW4uaWd0di5jMi4xMjgwLmJhc2VsaW5lIn0&_nc_cat=106&vs=228411496701692_1798827021&_nc_vs=HBksFQIYTGlnX2JhY2tmaWxsX3RpbWVsaW5lX3ZvZC9EMTRDQ0I5N0VENzE5NjY2NERBNzc4RjJGOTZCMzc4MV92aWRlb19kYXNoaW5pdC5tcDQVAALIAQAVAhg6cGFzc3Rocm91Z2hfZXZlcnN0b3JlL0dCWG9qQmRRbFpELTlrWUdBS09MUXFPNzcza3ZicGt3QUFBRhUCAsgBACgAGAAbAYgHdXNlX29pbAExFQAAJtbvvaPO48k%2FFQIoAkMzLBdAXZmZmZmZmhgSZGFzaF9iYXNlbGluZV8xX3YxEQB17AcA&_nc_rid=9776fd0b20&ccb=9-4&oh=00_AYCqpIhL8Zwrrs5rvzGzp-V358ade9ReRKY_gNTulE9dYA&oe=672F3AF4&_nc_sid=8b3546,760846,619,False,1606398554,142182,,118.4,"[""KONNIJIWA GAIS! Sudah lihat video battle bahasa Indonesiaku yang sama Erika, 'kan?\n\nTernyata ada banyak aturan dalam Bahasa Indonesia yang masih asing yak hahah. Nah, sekarang aku mau kasih tahu kalian, bagaimana sih proses dan apa saja syarat agar sebuah kata bisa masuk ke dalam Kamus Besar Bahasa Indonesia (KBBI)?\n\nSelamat menonton, ya! Semoga bermanfaat! Mari kita junjung tinggi bahasa persatuan, bahasa Indonesia!\n\n*Video kerja sama dengan @badanbahasakemendikbud""]"
2301672326781310216,271698321,PASS THE ENERGY CHALLENGE!,B_xLslTJZUI,https://scontent-lga3-2.cdninstagram.com/v/t51.2885-15/95437230_233203631299920_2063373619432567571_n.jpg?stp=dst-jpg_e35&_nc_ht=scontent-lga3-2.cdninstagram.com&_nc_cat=100&_nc_ohc=wb_cvN7a46UQ7kNvgHNjHNS&_nc_gid=9776f66361f94a09a0abe1ca305e7b8f&edm=AOQ1c0wBAAAA&ccb=7-5&oh=00_AYCfFBaNyjcBm4VsI29o0h1Dmr-3pSwzx_HKORK604thQA&oe=67332FEE&_nc_sid=8b3546,https://scontent-lga3-1.cdninstagram.com/o1/v/t16/f1/m84/7D48AB71E07889C1D88499B79DB90B82_video_dashinit.mp4?stp=dst-mp4&efg=eyJxZV9ncm91cHMiOiJbXCJpZ193ZWJfZGVsaXZlcnlfdnRzX290ZlwiXSIsInZlbmNvZGVfdGFnIjoidnRzX3ZvZF91cmxnZW4uaWd0di5jMi43MjAuYmFzZWxpbmUifQ&_nc_cat=111&vs=3193928114245445_2718466918&_nc_vs=HBksFQIYTGlnX2JhY2tmaWxsX3RpbWVsaW5lX3ZvZC83RDQ4QUI3MUUwNzg4OUMxRDg4NDk5Qjc5REI5MEI4Ml92aWRlb19kYXNoaW5pdC5tcDQVAALIAQAVAhg6cGFzc3Rocm91Z2hfZXZlcnN0b3JlL0dHOThsaGR6QVVsTXVJSURBQzVUaXhCaXZESXhicGt3QUFBRhUCAsgBACgAGAAbAYgHdXNlX29pbAExFQAAJvjjlIHC87k%2FFQIoAkMzLBdAYYAAAAAAABgSZGFzaF9iYXNlbGluZV8xX3YxEQB17AcA&_nc_rid=9776f24598&ccb=9-4&oh=00_AYCfMmbzJKNwLTeo_9QjP0WfOS4-8xeuH9AP4-fWsXNrRg&oe=672F3F1B&_nc_sid=8b3546,1773610,11843,False,1588601016,422632,,140.0,"['YOW! Kali ini aku dan temen2 lain bikin PASS THE ENERGY CHALLENGE! Bikinnya cukup susah apalagi ngajak temen2 Jepang HAHAHA. Proud to be a part of this, Muantappu jiwaa 🔥 semangat terus!\n\nJerome - @jeromepolin\nTomo - @tomoyama32\nTurah - @turahparthayana\nLeo - @leo_edw\nOtsuka - @otk_rym\nTakuya - @oke_jadi\nJehian - @jehianps\nHansol - @hansoljang110\nYusuke - @skzk_yusuke\nErika - @erika_ebisawa']"
3005008895279472482,298160527,,Cmz76tGBZ9i,https://scontent-lga3-2.cdninstagram.com/v/t51.2885-15/322421588_5869934943122743_3366793805692258858_n.jpg?stp=dst-jpg_e15&_nc_ht=scontent-lga3-2.cdninstagram.com&_nc_cat=107&_nc_ohc=4EBB6_0QZ2cQ7kNvgGLlrWa&_nc_gid=ccb15cdba88a482bb7b48252a5f64ebc&edm=AOQ1c0wBAAAA&ccb=7-5&oh=00_AYCATIHk6oc8138FYQKqU4-gTLNv4sxvIcKwKuMt5KyR-w&oe=673328BA&_nc_sid=8b3546,https://scontent-lga3-2.cdninstagram.com/o1/v/t16/f2/m69/AQM78SHzCdeKJc0VRw9qy8seHzSUvTwzXHB-GLKAgWWbSbn9AT4J8UNOcZM_nFNzqydv8oAszzgws9NiXkJ-6OC_.mp4?stp=dst-mp4&efg=eyJxZV9ncm91cHMiOiJbXCJpZ193ZWJfZGVsaXZlcnlfdnRzX290ZlwiXSIsInZlbmNvZGVfdGFnIjoidnRzX3ZvZF91cmxnZW4uaWd0di5jMi43MjAuYmFzZWxpbmUifQ&_nc_cat=105&vs=531889595637294_11243925&_nc_vs=HBksFQIYOnBhc3N0aHJvdWdoX2V2ZXJzdG9yZS9HSUNXbUFCNkZaSThZeGtFQU5PZldDOHFSMXNBYnZWQkFBQUYVAALIAQAVAhg6cGFzc3Rocm91Z2hfZXZlcnN0b3JlL0dETnJRaFBKcEwybUh2MERBQkc3a2trRDhSUm5idlZCQUFBRhUCAsgBACgAGAAbAYgHdXNlX29pbAExFQAAJoqbwdC5qdA%2FFQIoAkMzLBdATrMzMzMzMxgSZGFzaF9iYXNlbGluZV8xX3YxEQB17AcA&_nc_rid=ccb155d57f&ccb=9-4&oh=00_AYCzCxFz0kJPtccuko5_WlRMB67pHAjhfeo8dqC3au04PQ&oe=672F243B&_nc_sid=8b3546,229540,94,False,1672445010,17545,,61.4,['Quem é a mulher que sobreviveu a um enforcamento?']
2951277719656987339,298160527,,Cj1C3MRrfrL,https://scontent-lga3-2.cdninstagram.com/v/t51.2885-15/311791620_414986397490945_2817809546657681926_n.jpg?stp=dst-jpg_e15_fr_p1080x1080&_nc_ht=scontent-lga3-2.cdninstagram.com&_nc_cat=101&_nc_ohc=45fziU6giiUQ7kNvgELoHIm&_nc_gid=ccb15cdba88a482bb7b48252a5f64ebc&edm=AOQ1c0wBAAAA&ccb=7-5&oh=00_AYCC0cve9ZsPiFHMrB0eucMcCKAj7EPQN9EFopkOyX6M9g&oe=673340DA&_nc_sid=8b3546,https://scontent-lga3-2.cdninstagram.com/o1/v/t16/f2/m69/AQMWMH_k-IfKMZdUEHukY6rEu3h6Y34pPw2Ecixs-Re31L3zPjasp7eb0ZJBQdtGKpBtuBiWis7vSkz3TAiIGfqT.mp4?stp=dst-mp4&efg=eyJ2aWRlb19pZCI6IjQyOTc3MjEzOTIzMDY0MyIsInFlX2dyb3VwcyI6IltcImlnX3Byb2dyZXNzaXZlX3VybGdlbi5wcm9kdWN0X3R5cGUuaWd0dlwiXSIsInZlbmNvZGVfdGFnIjoiaWdfcHJvZ3Jlc3NpdmVfdXJsZ2VuLmlndHYuYzIueHB2X2hkX3Byb2dyZXNzaXZlIn0&_nc_cat=101&ccb=9-4&oh=00_AYC8WtC3AxuHqO6mcQxrxsCOp6L6aGnHrlgDQ0SzGpWyCQ&oe=672F34EC&_nc_sid=8b3546,386878,385,False,1666039779,36818,,86.763,['Será que ele vai ainda vai esperar muito tempo?']
2918004301001292660,298160527,,Ch-1XOWPnt0,https://scontent-lga3-1.cdninstagram.com/v/t51.2885-15/302428062_189370360221788_3179506669310151945_n.jpg?stp=dst-jpg_e15_fr_p1080x1080&_nc_ht=scontent-lga3-1.cdninstagram.com&_nc_cat=108&_nc_ohc=ftw_RN5T4KMQ7kNvgGU6E53&_nc_gid=ccb15cdba88a482bb7b48252a5f64ebc&edm=AOQ1c0wBAAAA&ccb=7-5&oh=00_AYC620mj4cG8qcwCEa922bn5--iBTV6PnVcb4PYqoF5uqQ&oe=6733408D&_nc_sid=8b3546,https://scontent-lga3-2.cdninstagram.com/o1/v/t16/f2/m69/AQO4jj4RbwgE8_0I36mygASg8dplC9c5xnqK8eNP7sAtZxHL5y3N0if5RFSBYL3K4rTxPB-eSOzeMMcaKZ95OOkb.mp4?stp=dst-mp4&efg=eyJ2aWRlb19pZCI6IjU4NjMwMjExOTg5NDI3NyIsInFlX2dyb3VwcyI6IltcImlnX3Byb2dyZXNzaXZlX3VybGdlbi5wcm9kdWN0X3R5cGUuaWd0dlwiXSIsInZlbmNvZGVfdGFnIjoiaWdfcHJvZ3Jlc3NpdmVfdXJsZ2VuLmlndHYuYzIueHB2X2hkX3Byb2dyZXNzaXZlIn0&_nc_cat=104&ccb=9-4&oh=00_AYAC4Cwm1KYDjAVzNnJz5aiWYZJJyW5wIJ3bWrR0qqY1aQ&oe=672F3A89&_nc_sid=8b3546,278532,189,False,1662073288,25778,,77.504,['Você sabia que a Nutella surgiu para ser um produto barato?']
2893936174465569929,298160527,,CgpU54xrFSJ,https://scontent-lga3-2.cdninstagram.com/v/t51.2885-15/296152604_784266509594131_7958794218096153244_n.jpg?stp=dst-jpg_e15&_nc_ht=scontent-lga3-2.cdninstagram.com&_nc_cat=107&_nc_ohc=_2Op7JhzDpIQ7kNvgFvXfU7&_nc_gid=ccb15cdba88a482bb7b48252a5f64ebc&edm=AOQ1c0wBAAAA&ccb=7-5&oh=00_AYBLtrG6_WmB0JMhvr-VRZpIy9SP8YYP3aU4nUJO_gap2Q&oe=673323C4&_nc_sid=8b3546,https://scontent-lga3-1.cdninstagram.com/o1/v/t16/f2/m69/AQPKYn0lmuWJRa1FAsP2MmzIBrN_UZOqdNTKpY6ayHCaRcxqyvCB4FdiqNyhzNYMaUb24UD8lWmfoYK0F4DpEowo.mp4?stp=dst-mp4&efg=eyJxZV9ncm91cHMiOiJbXCJpZ193ZWJfZGVsaXZlcnlfdnRzX290ZlwiXSIsInZlbmNvZGVfdGFnIjoidnRzX3ZvZF91cmxnZW4uaWd0di5jMi43MjAuYmFzZWxpbmUifQ&_nc_cat=110&vs=845892686378207_1635749251&_nc_vs=HBksFQIYOnBhc3N0aHJvdWdoX2V2ZXJzdG9yZS9HSUNXbUFDTFNkblZjWWtCQUdUT25GSGtHTE1BYnZWQkFBQUYVAALIAQAVAhg6cGFzc3Rocm91Z2hfZXZlcnN0b3JlL0dLMmJyUkVNX0lZTGRMMENBQTVlNmJMQkE0a1VidlZCQUFBRhUCAsgBACgAGAAbAYgHdXNlX29pbAExFQAAJo7r4qKO8e4%2FFQIoAkMzLBdAU5VP3ztkWhgSZGFzaF9iYXNlbGluZV8xX3YxEQB17AcA&_nc_rid=ccb154227a&ccb=9-4&oh=00_AYCacdqmJNwW_TNpQd-gh3GaSFZv5GvxkYGjE5awiLAm6g&oe=672F41B5&_nc_sid=8b3546,388901,287,False,1659204135,40598,,78.333,['Quem é o rapper que está construindo uma cidade?']
2893262997791472814,298160527,,Cgm714JJHyu,https://scontent-lga3-2.cdninstagram.com/v/t51.2885-15/296226401_5802198803147740_7652001149311483336_n.jpg?stp=dst-jpg_e15&_nc_ht=scontent-lga3-2.cdninstagram.com&_nc_cat=104&_nc_ohc=bV-db-qGHpsQ7kNvgEvouqd&_nc_gid=ccb15cdba88a482bb7b48252a5f64ebc&edm=AOQ1c0wBAAAA&ccb=7-5&oh=00_AYDUnvNJWh5eFMPRVTF82Y9zzJFHnxmArNETB9pLWW1Vwg&oe=67332732&_nc_sid=8b3546,https://scontent-lga3-2.cdninstagram.com/o1/v/t16/f2/m69/AQNGiyylLA6PJQ9JRjW3vlO55mmMKiarAaHh6hZMmPudv1ptnnOnE5KSdoURHrkfXV5ENp4kc72-T7dLYGNrs_m7.mp4?stp=dst-mp4&efg=eyJxZV9ncm91cHMiOiJbXCJpZ193ZWJfZGVsaXZlcnlfdnRzX290ZlwiXSIsInZlbmNvZGVfdGFnIjoidnRzX3ZvZF91cmxnZW4uaWd0di5jMi43MjAuYmFzZWxpbmUifQ&_nc_cat=107&vs=5933478616699443_3986349964&_nc_vs=HBksFQIYOnBhc3N0aHJvdWdoX2V2ZXJzdG9yZS9HSUNXbUFEQWN0ZTY4SkFCQUlkbURpZ0ZycGdQYnZWQkFBQUYVAALIAQAVAhg6cGFzc3Rocm91Z2hfZXZlcnN0b3JlL0dMcG9wUkZybFdCZmtPVUxBRUVSRERTSmZNSV9idlZCQUFBRhUCAsgBACgAGAAbAYgHdXNlX29pbAExFQAAJo6a2pOO0OI%2FFQIoAkMzLBdAUCQ5WBBiThgSZGFzaF9iYXNlbGluZV8xX3YxEQB17AcA&_nc_rid=ccb1590a3b&ccb=9-4&oh=00_AYCZBGVb_vf0-6amrt7dG_ZiNdHZPkCZdnHOJkwzTroNBw&oe=672F2E86&_nc_sid=8b3546,176656,251,False,1659124019,13798,,64.566,['Por que não voltamos à Lua?']
